{
  "$schema": "https://catalog.msh.team/misc/kimi.plugin.schema.json",
  "name": "framer",
  "version": "0.2.0",
  "description": "Framer's official hosted MCP server (https://mcp.framer.com/mcp, Streamable HTTP). Sign in with your Framer account in the browser (OAuth); no API key, token or env var is stored by this plugin. Read pages and CMS, propose changes, publish only with explicit user OK.",
  "keywords": [
    "framer",
    "web design",
    "cms",
    "mcp",
    "oauth",
    "no-api-key"
  ],
  "author": "Local developer",
  "license": "MIT",
  "skillInstructions": "",
  "interface": {
    "displayName": "Framer",
    "shortDescription": "Framer's official hosted MCP — browser OAuth, no API key",
    "longDescription": "Framer's official hosted MCP server (https://mcp.framer.com/mcp, Streamable HTTP). Sign in with your Framer account in the browser (OAuth); no API key, token or env var is stored by this plugin. Read pages and CMS, propose changes, publish only with explicit user OK.",
    "developerName": "Local developer",
    "websiteURL": "https://www.framer.com/mcp/",
    "iconUrl": "",
    "category": "PRODUCTIVITY"
  },
  "skills": "./skills/",
  "mcpServers": {
    "framer": {
      "url": "https://mcp.framer.com/mcp"
    }
  },
  "sessionStart": {
    "skill": "framer"
  }
}
